Fantasy Landscape,Anime Art Style,Surreal Style,Digital Painting,Scenic,Nebula,Realistic,SciFi,Dreamlike,Interior Views,Sky,Dutch Masters,Modern Computer Animation,Infrared (Experimental Nature Scenes),Low Poly (Experimental),Advanced (No Style Words)
"A mystical, enchanted forest with ancient trees and magical creatures.","A bustling, neon-lit city filled with high-tech gadgets and futuristic architecture.","A surreal, dreamlike landscape with floating objects and strange, otherworldly creatures.","A stunning, photorealistic landscape with intricate details and breathtaking colors.","A serene, peaceful landscape with rolling hills and a gentle, babbling brook.","A stunning, otherworldly view of a colorful, vibrant nebula stretching out into infinity.","A stunning, photorealistic landscape with lifelike textures and realistic lighting.","A futuristic, high-tech cityscape with sleek, sophisticated architecture and advanced gadgets.","A surreal, dreamlike landscape of strange, otherworldly objects and creatures.","A beautifully-decorated, highly-detailed living room with comfortable furniture and elegant decor.","A stunning, vibrant sunset with vivid colors and warm, inviting lighting.","A highly-detailed, beautifully-rendered still life painting of a luxurious, opulent banquet with intricate details and vibrant colors.","A stunning, highly-detailed 3D animation of an epic, cinematic space battle with advanced visual effects and dramatic music.","A mesmerizing, hypnotic view of a lush, vibrant forest with warm, inviting lighting and surreal infrared effects.","A mesmerizing, hypnotic view of a futuristic, neon-lit cityscape with sleek, low-poly design and vibrant colors.","A stunning, highly-detailed view of an epic, fantastical landscape with breathtaking scenery and vivid colors."
"A breathtaking, panoramic view of a massive, imposing castle on a mountaintop.","A colorful, playful world filled with cute, chibi-style characters and whimsical scenery.","A mind-bending, psychedelic world filled with trippy, abstract shapes and colors.","An epic, grand-scale battle scene with highly-detailed, hyper-realistic characters and environments.","A stunning, panoramic view of a snow-capped mountain range at sunrise.","An awe-inspiring, epic journey through a vast, sprawling galaxy filled with stars and nebulae.","A breathtaking, hyper-realistic portrait with lifelike skin tones and intricate details.","An epic, intergalactic battle scene set against a backdrop of stunning, surreal nebulae and stars.","A mesmerizing, hypnotic journey through a strange, surreal world of bizarre and mysterious landscapes.","A stunning, highly-detailed view of a luxurious, modern kitchen with sleek, sophisticated appliances and lighting.","A breathtaking, panoramic view of a clear, starry night sky with bright, twinkling stars.","A stunning, highly-detailed portrait painting of a noble, elegant subject with intricate details and dramatic lighting.","A mesmerizing, hypnotic 3D animation of a futuristic, neon-lit cityscape with fast-paced movement and vibrant colors.","A surreal, dreamlike view of a tranquil, serene lake with warm, inviting lighting and strange, otherworldly infrared effects.","A surreal, dreamlike view of a fantastical, otherworldly landscape with strange, low-poly objects and vivid colors.","A mesmerizing, hypnotic view of a surreal, dreamlike world with strange, otherworldly objects and rich, vibrant colors."
"A surreal, dreamlike environment with floating islands and strange, otherworldly creatures.","A dramatic, action-packed scene with dynamic, anime-style characters engaged in battle.","A dark, eerie environment with twisted, surreal forms and haunting atmosphere.","A beautiful, serene portrait with soft, delicate colors and lifelike details.","A breathtaking, picturesque coastline with rugged cliffs and crashing waves.","A breathtaking, panoramic view of a massive, glowing supernova exploding in the darkness of space.","A realistic, highly-detailed cityscape with lifelike textures and lighting.","A mind-bending, surreal landscape of advanced, sci-fi technology and otherworldly creatures.","A mind-bending, surreal dreamscape of strange, otherworldly architecture and floating objects.","A cozy, intimate bedroom with comfortable bedding and warm, inviting lighting.","A mesmerizing, hypnotic view of a dramatic, stormy sky with dark, ominous clouds.","A breathtaking, highly-detailed landscape painting of a majestic, expansive vista with rich colors and intricate details.","A breathtaking, highly-detailed 3D animation of a majestic, fantastical world with lush landscapes and vibrant colors.","A breathtaking, highly-detailed view of a majestic, snow-capped mountain range with warm, inviting lighting and vibrant infrared colors.","A breathtaking, highly-detailed view of a majestic, expansive vista with stunning low-poly design and rich colors.","A surreal, otherworldly view of a strange, alien landscape with bizarre, floating objects and beautiful, vibrant colors."
"An ethereal, mystical garden filled with glowing flowers and exotic plants.","A peaceful, idyllic village filled with charming, anime-style characters and lush, vibrant scenery.","An abstract, minimalist world with geometric shapes and stark, contrasting colors.","A vivid, colorful scene with bold, striking brushstrokes and abstract shapes.","A beautiful, tranquil lake surrounded by colorful, autumnal foliage.","A mesmerizing, hypnotic trip through the swirling, colorful gases and dust of a massive nebula.","A beautifully-rendered, lifelike still life with intricate details and vibrant colors.","A thrilling, action-packed chase scene through a futuristic, cyberpunk metropolis.","A surreal, dreamlike landscape of vivid, colorful shapes and patterns.","A breathtaking, highly-detailed view of an opulent, luxurious bathroom with intricate details and elegant fixtures.","A surreal, dreamlike view of a colorful, otherworldly sky filled with strange, floating objects.","A beautifully-rendered, highly-detailed seascape painting with dramatic lighting and intricate details.","A beautifully-rendered 3D animation of a magical, fantastical world filled with strange creatures and vibrant colors.","A beautifully-rendered view of a tranquil, peaceful waterfall with warm, inviting lighting and surreal infrared effects.","A beautifully-rendered view of a tranquil, peaceful forest with warm, inviting low-poly design and surreal, dreamlike effects.","A breathtaking, highly-detailed view of a majestic, snow-capped mountain range with stunning scenery and vivid colors."
"A magical, whimsical land of fairies and mythical creatures, with colorful forests and sparkling waterfalls.","A dark, brooding landscape filled with intense, anime-style characters and dramatic lighting.","A fantastical, dreamlike world filled with impossible architecture and whimsical creatures.","An intricate, highly-detailed cityscape with realistic lighting and textures.","A peaceful, idyllic countryside scene with fields of wildflowers and grazing animals.","A surreal, dreamlike landscape of strange, glowing nebulae and sparkling stars.","A realistic, highly-detailed portrait with lifelike features and realistic lighting.","A vast, sprawling space station with highly-detailed, hyper-realistic architecture and lighting.","A mesmerizing, hypnotic trip through a strange, otherworldly forest filled with vibrant colors and strange creatures.","A beautifully-rendered, highly-detailed view of a spacious, inviting library with comfortable seating and warm lighting.","A stunning, panoramic view of a majestic, snow-capped mountain range with a clear, blue sky.","A stunning, highly-detailed view of an opulent, luxurious interior with rich colors and intricate details.","A stunning, highly-detailed 3D animation of a surreal, dreamlike world with vivid colors and strange, otherworldly objects.","A stunning, panoramic view of a clear, blue sky with fluffy, white clouds and warm, inviting infrared lighting.","A stunning, panoramic view of a clear, blue sky with fluffy, white clouds and sleek, low-poly design.","A beautifully-rendered view of a tranquil, peaceful forest with lush greenery and warm, inviting lighting."
"A vast, open plain filled with towering, mystical pillars and ancient ruins.","A thrilling, high-speed chase scene through a futuristic, cyberpunk city.","A surreal, nightmarish landscape with twisted, distorted forms and surreal lighting.","A stunning, hyper-realistic portrait with lifelike skin tones and intricate details.","A mesmerizing, otherworldly desert landscape with towering sand dunes and stunning sunsets.","A stunning, realistic depiction of the vast, endless expanse of space with stars and planets in the distance.","A stunning, photorealistic landscape with lifelike trees and plants and realistic lighting.","An awe-inspiring, epic view of a massive, interstellar spaceship traveling through the cosmos.","A surreal, dreamlike journey through a strange, otherworldly cityscape filled with bizarre architecture and objects.","A stunning, highly-detailed view of a sophisticated, modern office with sleek, minimalist furniture and advanced technology.","A peaceful, idyllic view of a tranquil, cloudless sky with warm, inviting lighting.","A breathtaking, highly-detailed portrait painting of a beautiful, elegant woman with dramatic lighting and intricate details.","A breathtaking, highly-detailed 3D animation of an epic, cinematic battle between advanced, robotic mechs with intense action and drama.","A surreal, dreamlike view of a strange, otherworldly landscape with vivid infrared colors and bizarre, floating objects.","A surreal, dreamlike view of a strange, alien sky filled with bizarre, floating low-poly objects and vivid colors.","A stunning, panoramic view of a clear, blue sky with fluffy, white clouds and beautiful, warm lighting."
"A stunning, otherworldly landscape of jagged cliffs and glowing crystals.","A fantastical, epic adventure through a world filled with anime-style characters and magical creatures.","A surreal, psychedelic journey through a strange, otherworldly realm.","A vibrant, colorful world with highly-detailed textures and intricate patterns.","A stunning, panoramic view of a lush, tropical rainforest with exotic flora and fauna.","An epic, cinematic space battle set against a backdrop of stunning, surreal nebulae.","A realistic, highly-detailed depiction of a bustling city street with lifelike textures and lighting.","A mesmerizing, hypnotic trip through a futuristic, neon-lit cityscape.","A mesmerizing, hypnotic trip through a strange, otherworldly landscape of strange, floating objects and colorful shapes.","A breathtaking, highly-detailed view of a spacious, elegant dining room with intricate details and sophisticated decor.","A surreal, dreamlike view of a strange, otherworldly sky filled with vivid, swirling colors.","A highly-detailed, beautifully-rendered still life painting of a lush, vibrant bouquet of flowers with intricate details and rich colors.","A mesmerizing, hypnotic 3D animation of a surreal, dreamlike landscape with strange, floating objects and vibrant colors.","A mesmerizing, hypnotic view of a lush, vibrant forest with warm, inviting infrared lighting and strange, surreal effects.","A mesmerizing, hypnotic view of a lush, vibrant landscape with warm, inviting low-poly design and surreal, dreamlike effects.","A mesmerizing, hypnotic view of a magical, fantastical world with strange creatures and beautiful, vibrant colors."
"A dark, ominous forest filled with twisted, gnarled trees and eerie creatures.","A charming, slice-of-life scene with lovable, anime-style characters in a cozy, comfortable setting.","A haunting, surreal landscape with ghostly apparitions and unsettling atmosphere.","A breathtaking, photorealistic still life with highly-detailed textures and vibrant colors.","A majestic, awe-inspiring waterfall cascading down into a crystal-clear pool below.","A mesmerizing, hypnotic view of a massive, spiraling galaxy stretching out into infinity.","A breathtaking, hyper-realistic depiction of a majestic animal with intricate fur and lifelike features.","A thrilling, heart-pumping battle sequence between advanced, robotic mechs.","A surreal, dreamlike landscape of strange, otherworldly creatures and objects floating in a sea of vivid colors.","A cozy, intimate study with comfortable seating and warm, inviting lighting.","A mesmerizing, hypnotic view of a stunning, otherworldly sunrise with vivid colors and strange, swirling clouds.","A stunning, highly-detailed portrait painting of a powerful, distinguished man with intricate details and dramatic lighting.","A stunning, highly-detailed 3D animation of a futuristic, technologically-advanced world with sleek, sophisticated design.","A surreal, dreamlike view of a tranquil, serene lake with warm, inviting infrared lighting and vibrant, surreal colors.","A surreal, dreamlike view of a tranquil, serene lake with warm, inviting low-poly design and vibrant, surreal colors.","A surreal, dreamlike view of a tranquil, peaceful lake with warm, inviting lighting and beautiful colors."
"A magical, underwater world filled with colorful coral and strange sea creatures.","A mesmerizing, psychedelic world with trippy, anime-inspired visuals and mind-bending effects.","A trippy, surreal adventure through a world filled with strange, surreal creatures and objects.","An epic, cinematic landscape with stunning, realistic lighting and textures.","A tranquil, serene garden with lush greenery and beautiful, blooming flowers.","A stunning, panoramic view of a massive, glowing gas giant planet surrounded by colorful, swirling storms.","A beautifully-rendered, lifelike depiction of a peaceful, idyllic countryside with realistic lighting and textures.","A surreal, dreamlike landscape of advanced, cybernetic technology and bizarre, otherworldly creatures.","A mind-bending, surreal landscape of strange, otherworldly shapes and patterns swirling in a sea of colors.","A beautifully-decorated, highly-detailed view of a serene, tranquil meditation room with warm, inviting lighting.","A breathtaking, panoramic view of a clear, blue sky with fluffy, white clouds and warm, inviting lighting.","A breathtaking, highly-detailed landscape painting of a serene, tranquil scene with soft, muted colors and intricate details.","A beautifully-rendered 3D animation of a fantastical, otherworldly world with strange creatures and surreal landscapes.","A breathtaking, highly-detailed view of a majestic, towering mountain peak with warm, inviting infrared lighting and vivid colors.","A breathtaking, highly-detailed view of a majestic, towering mountain peak with sleek, low-poly design and vivid colors.","A breathtaking, highly-detailed view of a majestic, towering mountain peak with stunning scenery and beautiful, warm lighting."
"A fantastical, mystical city with towering spires and sparkling lights.","A whimsical, fantastical world filled with cute, anime-style animals and magical scenery.","A surreal, abstract world filled with intriguing, thought-provoking imagery and symbolism.","A beautiful, realistic depiction of a peaceful, idyllic countryside with lush greenery and serene skies.","A picturesque, rustic countryside scene with charming, old-fashioned architecture and vibrant colors.","A surreal, dreamlike view of a massive, glowing nebula filled with strange, otherworldly creatures and objects.","A stunning, photorealistic depiction of a tranquil, serene beach with lifelike textures and lighting.","An epic, cinematic space battle set against a backdrop of stunning, surreal planets and stars.","A surreal, dreamlike journey through a strange, otherworldly world of bizarre architecture and objects.","A stunning, highly-detailed view of a spacious, elegant foyer with sophisticated lighting and luxurious decor.","A surreal, dreamlike view of a strange, alien sky filled with bizarre, floating objects and vivid, colorful shapes.","A beautifully-rendered, highly-detailed still life painting of a sumptuous, decadent feast with rich colors and intricate details.","A stunning, highly-detailed 3D animation of a magical, enchanted forest with lush, vibrant colors and beautiful lighting.","A beautifully-rendered view of a peaceful, tranquil forest with warm, inviting infrared lighting and surreal, dreamlike effects.","A beautifully-rendered view of a futuristic, technologically-advanced city with sleek, sophisticated low-poly design and vibrant colors.","A beautifully-rendered view of a futuristic, technologically-advanced city with sleek, sophisticated design and beautiful, vibrant colors."
